{
  "$schema": "./jurisdiction.schema.json",
  "jurisdictionId": "us-coppa-ferpa",
  "name": "United States - COPPA (15 U.S.C. 6501) & FERPA (34 CFR Part 99)",
  "status": "active",
  "governingRegulation": "Children's Online Privacy Protection Act (COPPA) & Family Educational Rights and Privacy Act (FERPA)",
  "minimumAgeRules": {
    "childAgeThreshold": 13,
    "parentalConsentRequiredUnder": 13
  },
  "consentRules": {
    "mechanism": "school_official_exception_or_verifiable_parental_consent",
    "verifiableParentalConsentRequired": true,
    "withdrawalPurgeSLAHours": 48
  },
  "retentionRules": {
    "maxInactiveStudentDataRetentionDays": 730,
    "allowAnonymizedResearchTelemetry": true
  },
  "safetyEscalationSLAHours": 6,
  "crossBorderTransferAllowed": false,
  "legalReview": {
    "reviewedBy": "Sarah Jenkins, Esq.",
    "firm": "Education Technology Legal Counsel PC, Washington DC",
    "reviewDate": "2026-08-25",
    "approved": true
  },
  "childSafetyReview": {
    "reviewerRole": "Head of Child Safeguarding & Educational Safety",
    "reviewDate": "2026-08-28",
    "approved": true
  }
}
